Anne De Salvo, Helen Stenborg, Kevin Bacon, Russell Horton, Jay O. Sanders, Charles Kimbrough, Austin Pendleton, Daniel Stern, Charles Durning, Wallace Shawn, Frances Sternhagen, Mary Kay Place, Jill Clayburgh, Burt Reynolds, Candice Bergen
Carrie Preston, Simon Helberg, Arden Myrin, Kevin Bacon, Alexandra Shipp, Madeline Brewer, Kyle Allen
Isabel Brousseau, Nancy Lenehan, Kevin Bacon, James Ray, Chris Young, Larry Hankin, John Ashton, William Windom, Paul Gleason, Dennis Dugan, Lyman Ward, Kellye Nakahara, Bronson Pinchot, Ted Danson, Elias Koteas, John Ratzenberger, Lisa Niemi, Gail O'Grady, Wil Wheaton, Edie McClurg, Annie Potts, Ally Sheedy, Penny Marshall, Dyan Cannon, Holland Taylor, Amy Irving, Elizabeth McGovern, Lili Taylor, John Candy, Woody Harrelson, Roy Orbison, Olivia Newton-John, Bill Erwin, Alec Baldwin, Kirstie Alley, Michael Keaton, Dan Aykroyd, Joanna Kerns, Bill Murray, Matthew Broderick
Conor O'Farrell, Kevin Bacon, Christian Stolte, Kevin Dunn, Lusia Strus, Kathryn Erbe, Illeana Douglas, Liza Weil, Jennifer Morrison
Peter Dinklage, Elijah Wood, Julia Davis, Kevin Bacon, Jonny Coyne, Taylour Paige, Jacob Tremblay
Kevin Bacon, Mike Colter, Tom Aldredge
Kevin Bacon, John Bennett Perry, David Dukes, Dan Monahan, James Coco, Kristy McNichol, Joan Hackett, Marsha Mason
Kevin Bacon, Machine Gun Kelly, Travis Fimmel
Marcia DeBonis, Barry Del Sherman, John Rothman, Bellina Logan, Andrea Bendewald, Kevin Bacon, Amelia Campbell, Sean Patrick Thomas, Kevin Dunn, Anne Twomey, Jay Mohr, Faith Prince, Faran Tahir, Greg Grunberg, Illeana Douglas, Olympia Dukakis, Jennifer Aniston, Kaley Cuoco
Kevin Bacon, Al Jean, Tim Matheson, Richard Belzer, Ivan Reitman, Christopher Guest, Judd Apatow, Chevy Chase, Harold Ramis, Gilda Radner, Beverly D'Angelo, John Goodman, Billy Bob Thornton, John Landis, Bill Murray, John Belushi
Kevin Bacon, David Alan Grier, Gina Philips, Eve, Kyra Sedgwick, Benjamin Bratt, Michael Shannon, Yasiin Bey
Larry Williams, Mark Wheeler, Ben Marley, Marilyn Lovell, Christopher John Fields, Joseph Culp, Todd Hallowell, Thomas Mills Wood, Ned Vaughn, Michele Little, Jon Bruno, Gabriel Jarret, Jean Speegle Howard, Ben Bodé, Paul Mantee, Carl Gabriel Yorke, Kevin Bacon, Jim Meskimen, Jack Conley, Todd Louiso, Ray McKinnon, Rance Howard, Steve Rankin, Max Elliott Slade, Jeffrey Kluger, Herbert Jefferson Jr., Geoffrey Blake, Emily Ann Lloyd, Marc McClure, Thom Barry, Clint Howard, Christian Clemenson, Miko Hughes, Austin O'Brien, Max Grodénchik, Chris Ellis, Tracy Reiner, Mary Kate Schellhardt, Loren Dean, Xander Berkeley, Andy Milder, David Andrews, Roger Corman, Kathleen Quinlan, Bryce Dallas Howard, Wayne Duvall, Brian Markinson, Joe Spano, Gary Sinise, Brett Cullen, Jim Lovell, Bill Paxton, Ed Harris, Walter Cronkite, Tom Hanks
Yolanda Vazquez, Sean McCann, Kevin Bacon, Winston Ntshona
Kevin Bacon, Kevin Chapman, Robert Wahlberg, Spencer Treat Clark, Tom Guiry, John Doman, Kevin Conway, Connor Paolo, Jonathan Togo, Marcia Gay Harden, Laura Linney, Laurence Fishburne, Eli Wallach, Tim Robbins, Sean Penn, Emmy Rossum
Kevin Bacon, Caitlin Wachs, Clint Howard, Carl Davis, Harry Connick Jr., Cody Linley, Frankie Muniz, Diane Lane, Luke Wilson
Michelle Hurst, Nancy La Scala, Kevin Bacon, Arthur J. Nascarella, Jennifer Jason Leigh, Meg Ryan, Mark Ruffalo, Patrice O'Neal
Paulo Benedeti, Antoni Corone, Kevin Bacon, Daphne Rubin-Vega, Marc Macaulay, Gina LaMarca, Jen Taylor, Eduardo Yáñez, Jeff Perry, Robert Wagner, Carrie Snodgress, Jennifer Taylor, Theresa Russell, Denise Richards, Neve Campbell, Matt Dillon, Bill Murray
Kevin Bacon, Charles McCaughan, Louie Anderson, Andrew Smith, Paul Rodriguez, Jami Gertz, Laurence Fishburne
Charles Tyner, Carol Bruce, Susan Kellerman, Kevin Bacon, Larry Hankin, Nick Wyman, Richard Herd, Michael McKean, Ben Stein, Laila Robins, Dylan Baker, Martin Ferrero, William Windom, Troy Evans, Olivia Burnette, Lyman Ward, Matthew Lawrence, Diana Douglas, Edie McClurg, Jeri Ryan, John Candy, Bill Erwin, Steve Martin
Jodie Markell, Andrew Airlie, Kevin Bacon, Steve Rankin, Pruitt Taylor Vince, Gerry Becker, Stuart Townsend, Garry Chalk, Courtney Love, Colleen Camp, Dakota Fanning, Charlize Theron
Amanda Seyfried, Kevin Bacon
William Hall, Stuart Nisbet, Laird Macintosh, Eve Brenner, Kevin Bacon, Wally Rose, Stefan Gierasch, Bill Barretta, Neil Summers, Charles Cyphers, Time Winters, Herb Ritts, Stephen Tobolowsky, R. Lee Ermey, Brad Dourif, Embeth Davidtz, Mia Kirshner, Kyra Sedgwick, William H. Macy, Christian Slater, Gary Oldman
Kevin Bacon, Tony Genaro, Richard Marcus, Robert Jayne, Victor Wong, Michael Gross, Charlotte Stewart, Finn Carter, Fred Ward, Ariana Richards, Reba McEntire
Paul Herman, Joseph Perrino, William Butler, Kevin Bacon, Peter Appel, Ben Hammer, Peter McRobbie, Eugene Byrd, Terry Kinney, Dash Mihok, Peter Gerety, Wendell Pierce, Frank Medrano, Geoffrey Wigdor, Jonathan Tucker, Bruno Kirby, Ron Eldard, John Slattery, Jason Patric, Jeffrey Donovan, Billy Crudup, Minnie Driver, Brad Renfro, Aida Turturro, Vittorio Gassman, Dustin Hoffman, James Pickens, Robert De Niro, Brad Pitt
April Mullen, Kevin Bacon, Grim Natwick, Vanessa Zima, Aidan Quinn, Dan Lett, Jill Scott, Sherilyn Fenn, Kyra Sedgwick, Jackie Burroughs
Kevin Bacon, Jonathan Ward, Sean Astin
Gareth Williams, Kevin Bacon, Marian Seldes, Cathy Moriarty, Mary Stuart Masterson, Evan Rachel Wood
Shangela Laquifa Wadley, Michael Yebba, Kevin Bacon, Larry Joe Campbell, Mike O'Malley, Devin Ratray, James Hong, Marisa Miller, Mary-Louise Parker, Robert Knepper, Ryan Reynolds, Jeff Bridges, Stephanie Szostak
Chelcie Ross, Kevin Bacon, JoBe Cerny, Christian Stolte, Lynne Thigpen, Elias Koteas, Keith David, Scott Caan, Laura Dern, Helena Bonham Carter, Steve Martin
Darwin Del Fabro, Quei Tann, Anna Lore, Cooper Koch, Austin Crute, Theo Germaine, Mark Ashworth, Kevin Bacon, Carrie Preston, Anna Chlumsky
Shea Whigham, Kevin Bacon, Camryn Manheim, Kyra Sedgwick
Paul D'Amato, Vinny Vella, Kevin Bacon, Annabella Sciorra, Jon Bon Jovi, Whoopi Goldberg, Demi Moore
Christian Pitre, Zayne Emory, Mekia Cox, Kevin Bacon, Reggie Lee, Jonah Bobo, John Carroll Lynch, Dan Butler, Beth Littleford, Jenny Mollen, Karolina Wydra, Liza Lapira, Julianna Guill, Crystal Reed, Lio Tipton, Josh Groban, Steve Carell, Ryan Gosling, Marisa Tomei, Emma Stone, Joey King, Julianne Moore
Ellen McElduff, Duane Grey, Wayne Tippit, Marco Perella, John S. Davies, Jo Anderson, George R. Robertson, Gail Cronauer, Darryl Cox, Rika Dialina, Richard Rutowski, Kevin Bacon, Peter Maloney, James N. Harrell, John Finnegan, Jerry Douglas, Willem Oltmans, Jay O. Sanders, Pruitt Taylor Vince, Brian Doyle-Murray, Leonid Brezhnev, Edwin Neal, Gary Grubbs, Tony Plana, Michael Rooker, John Larroquette, Beata Pozniak, Jim Garrison, Tomas Milian, Ron Rifkin, Bob Gunton, Vincent D'Onofrio, Wayne Knight, Sean Stone, Lolita Davidovich, Frank Whaley, Laurie Metcalf, Sally Kirkland, John Candy, Walter Matthau, Sissy Spacek, Martin Sheen, Tommy Lee Jones, Jacqueline Kennedy Onassis, Ed Asner, Donald Sutherland, Jack Lemmon, Gary Oldman, Dale Dye, Joe Pesci, Kevin Costner
Kevin Bacon, Djimon Hounsou
Phoebe Strole, Kevin Bacon, Veronica Taylor, Rachel Specter, Troy Garity, Steven Weber, Mark Rendall, Robin Weigert, Eric McCormack, Chris Noth, Nick Stahl, Logan Lerman, David Koechner, Renée Zellweger, Molly Quinn
James Widdoes, James Daughton, Sunny Johnson, Kevin Bacon, Mary Louise Weller, Mark Metcalf, Douglas C. Kenney, Peter Riegert, John Vernon, Stephen Furst, Tim Matheson, Verna Bloom, Bruce McGill, Cesare Danova, Tom Hulce, Karen Allen, Donald Sutherland, John Belushi
Kevin Bacon, Deborah Falconer, Kristin Dattilo, Bruce Payne, Kyra Sedgwick
Kevin Bacon, Ron White, Irma P. Hall, John Patrick Amedori, Ray Stevenson, Robert Patrick, Frances O'Connor, Shawnee Smith, Billy Bob Thornton, John Hurt, Robert Duvall, Tippi Hedren, Katherine LaNasa
Jamie Bernadette, David Mazouz, Kevin Bacon, Matt Walsh, Lucy Fry, Tara Lynne Barr, Paul Reiser, Ming-Na Wen, Radha Mitchell, Jennifer Morrison
Harry Caesar, Ron Ostrow, Cameron Thor, Kevin Bacon, Michael DeLorenzo, Alex Wexo, Geoffrey Nauffts, Wolfgang Bodison, J. A. Preston, David Bowe, John M. Jackson, Matt Craven, J. T. Walsh, James Marshall, Xander Berkeley, Kevin Pollak, Christopher Guest, Noah Wyle, Aaron Sorkin, Cuba Gooding Jr., Kiefer Sutherland, Joshua Malina, Demi Moore, Jack Nicholson, Tom Cruise
Brock Simpson, Linda Shayne, Marian Waldman, Amy Holden Jones, Kevin Bacon, Robbi Morgan, Tony Moran, Jeannine Taylor, Adrienne King, Paul Lynch, Felissa Rose, Sean S. Cunningham, Armand Mastroianni, Drew Barrymore, Harry Manfredini, Bob Clark, Christa Campbell, Lilyan Chauvin, Joseph Stefano, Donald Pleasence, Robert Englund, Rob Zombie, Betsy Palmer, Debra Hill, Priscilla Barnes, Daphne Zuniga, Wes Craven, David Boreanaz, Janet Leigh, Anthony Perkins, Tom Savini, John Carpenter, Jimmy Carter, Joseph Zito
Kevin Bacon, Rob Moran, Maurice Bénard, Mark O'Meara, Erik Estrada, Payne Stewart, Tom Arnold, Victoria Tennant, Cindy Crawford, William Dozier
Kevin Bacon
Kevin Bacon, Pauly Shore, Ron Jeremy, Chris Noth, Rob Zombie, Topher Grace, Jesse Spencer, Jamie-Lynn Sigler, Teresa Palmer, Traci Lords, Julianne Hough, Victoria Justice, Brooke Shields, Hulk Hogan, Matthew Broderick
Kevin Bacon, John Lithgow, Chris Penn, Lori Singer, Dianne Wiest, Frances Lee McCain, Sarah Jessica Parker
Kevin Bacon, Mark Margolis, Michael Tucker, Paul Reiser, Daniel Stern, Tim Daly, Steve Guttenberg, Ellen Barkin, Mickey Rourke
Rebecca Davis, Erika Rosenbaum, Michael J. Reynolds, Seán Cullen, Sonja Bennett, Kevin Bacon, Gabrielle Rose, David Hayman, Maury Chaykin, Beau Starr, David Hemblen, Arsinée Khanjian, Anna Silk, Don McKellar, Rachel Blanchard, Colin Firth, Alison Lohman
George Martin, Kevin Bacon, Charlayne Woodard, Ashley Gardner, Stanley Anderson, R. Paul Butler, Phil Leeds, Nathan Lane, Anthony LaPaglia, Erika Alexander, Elizabeth Perkins, Sharon Stone
Eve Curtis, Mark Simich, Keith MacKechnie, Eloy Casados, Kate Jennings Grant, Kaine Bennett Charleston, Jenn Gotzon Chandler, Jay White, Gene Boyer, Gavin Grazer, Gabriel Jarret, Kevin Bacon, Jim Meskimen, Rance Howard, Geoffrey Blake, Marc McClure, Clint Howard, Patty McCormack, Andy Milder, Oliver Platt, Toby Jones, Sam Rockwell, Matthew Macfadyen, Frank Langella, Michael Sheen, Rebecca Hall, Joe Spano, Gerald Ford
Kevin Bacon, Ethan Hawke, Mahershala Ali, Julia Roberts, Myha'la Herrold
Lisa Owen, Diana García, Todd Stashwick, Kevin Bacon, Taylor Nichols, Victor Rivers, Evan Parke, Cecilia Suárez, Jon Bernthal, John Cho, Jason Dolley, Emile Hirsch, Sasha Pieterse, Kari Wuhrer, Kelly Hu, Brendan Fraser, Andy Garcia, Forest Whitaker, Sarah Michelle Gellar, Clark Gregg, Julie Delpy
Micky Levy, Bonnie Root, Steve Eastin, Kerri Randles, Kevin Bacon, Miles Heizer, Laura Cerón, Eugene Byrd, Margo Martindale, Marin Hinkle, Kathryn Joosten, Marcia Gay Harden
Tom Woodruff Jr., Margot Rose, Kevin Bacon, Jeffrey Scaperrotta, Joey Slotnick, William Devane, Greg Grunberg, Kim Dickens, Rhona Mitra, Elisabeth Shue, Pablo Espinosa, Josh Brolin
Brad Carter, Jeremy Strong, Owen Burke, Jim Ford, Jamie Donnelly, Erica McDermott, Bill Camp, Kevin Bacon, W. Earl Brown, Dakota Johnson, Scott G. Anderson, Jesse Plemons, James Russo, Rory Cochrane, David Harbour, Joel Edgerton, Peter Sarsgaard, Julianne Nicholson, Benedict Cumberbatch, Juno Temple, Adam Scott, Johnny Depp, Corey Stoll
Dave Bautista, Vin Diesel, Zoe Saldaña, Karen Gillan, Sean Gunn, Chris Pratt, Pom Klementieff, Kevin Bacon
Kevin Bacon, Michael Beach, Clint Howard, Wilford Brimley, Bob Balaban, Levon Helm, Howard Morris, Barbara Barrie, Mary Steenburgen, Holly Hunter
Eddie Murphy, Joseph Gordon-Levitt, Judge Reinhold, Mark Pellegrino, Paul Reiser, Bronson Pinchot, John Ashton, Kevin Bacon, Taylour Paige
Elizabeth Shepherd, Tyrone Benskin, Susan Glover, Sean McCann, Kevin Bacon, Ron Lea, Michael Sinelnikoff, Joe Don Baker, Tess Harper, Aidan Devine, Karen Young, Gary Oldman
Scott Coffey, Kim Miyori, Kevin Bacon, Stan Ivar, Michael McKean, Bruce Kirby, Richard Belzer, Nancy Valen, J. T. Walsh, Dan Schneider, Stephen Collins, Don Franklin, Martin Short, Elliott Gould, Eddie Albert, Roddy McDowall, June Lockhart, Jennifer Jason Leigh, Fran Drescher, Teri Hatcher, John Cleese
George Martin, Kevin Bacon, Charlayne Woodard, Ashley Gardner, Stanley Anderson, R. Paul Butler, Phil Leeds, Nathan Lane, Anthony LaPaglia, Erika Alexander, Elizabeth Perkins, Sharon Stone
Stuart Lafferty, Jordan Garrett, Kevin Bacon, Matt O'Leary, Leigh Whannell, Edi Gathegi, Garrett Hedlund, Aisha Tyler, Kelly Preston, Cloris Leachman, John Goodman
Harry Crosby, Kevin Bacon, Robbi Morgan, Rex Everhart, Jeannine Taylor, Laurie Bartram, Adrienne King, Ari Lehman, Betsy Palmer
Tom Clancy, Kevin Bacon, Gary Frank, Julie Harris, Glenn Ford
Stephen Blackehart, Kevin Bacon, Gregg Henry, William Katt, James Gunn, Michael Rooker, Andre Royo, Sean Gunn, Rainn Wilson, Nathan Fillion, Rob Zombie, Linda Cardellini, Lloyd Kaufman, Elliot Page, Liv Tyler, Zach Gilford
Christian Pitre, Zayne Emory, Mekia Cox, Kevin Bacon, Reggie Lee, Jonah Bobo, John Carroll Lynch, Dan Butler, Beth Littleford, Jenny Mollen, Karolina Wydra, Liza Lapira, Julianna Guill, Crystal Reed, Lio Tipton, Josh Groban, Steve Carell, Ryan Gosling, Marisa Tomei, Emma Stone, Joey King, Julianne Moore
Jodie Markell, Wendy Gazelle, Tony Spiridakis, Kevin Bacon, Janet Brandt, J. D. Daniels, Camille Saviola, Jenny Wright, Liane Alexandra Curtis, Ken Olin, Terry Kinney, Chloe Webb, Joe Mantegna, Kelly Bishop, Megan Mullally, Linda Fiorentino, Tom Waits, John Malkovich, Jamie Lee Curtis
Gene Farber, Neil Fingleton, Kevin Bacon, Randall Batinkoff, Álex González, Demetri Goritsas, Matt Craven, James Faulkner, Corey Johnson, Jason Beghe, Don Creech, Caleb Landry Jones, Bill Milner, Tony Curran, Brendan Fehr, Glenn Morshower, Ray Wise, Jason Flemyng, James Remar, Rade Šerbedžija, Michael Ironside, Oliver Platt, Edi Gathegi, Lucas Till, Nicholas Hoult, Morgan Lily, Annabelle Wallis, Sasha Pieterse, Rose Byrne, Zoë Kravitz, January Jones, Rebecca Romijn, James McAvoy, Jennifer Lawrence, Hugh Jackman, Aleksander Krupa, Ludger Pistor, Wilfried Hochholdinger, Michael Fassbender
Kevin Bacon, Elizabeth Hoffman, William Lucking, Glenn Morshower, Joseph Mazzello, Diane Delano, David Strathairn, John C. Reilly, Benjamin Bratt, Meryl Streep
Kevin Bacon, Michael J. Fox, Ted Danson, Henry Winkler, Ice-T, Dee Wallace, Judy Collins, John Candy, James Earl Jones, Bette Midler, Olivia Newton-John, Jennifer Love Hewitt, Jeremy Irons, Demi Moore, Meryl Streep
Sosie Bacon, Kevin Bacon, Dominic Scott Kay, Spencer Treat Clark, Campbell Scott, Oliver Platt, Blair Brown, Kyra Sedgwick, Matt Dillon, Marisa Tomei, Sandra Bullock
Kevin Bacon, Shauna O'Brien, Kimberly Scott, Julie Warner, Patricia Belcher, Oliver Platt, William Baldwin, Hope Davis, Kiefer Sutherland, Julia Roberts
Susan Blond, Meade Roberts, John Ford Noonan, Kevin Bacon, Mark Keyloun, Orson Bean, Esai Morales
Kevin Bacon, Paul Dooley, Jonathan Rhys Meyers, Maximilian Schell, Brad Renfro, Luke Wilson, Calista Flockhart
Andrew Levitas, Adele Givens, Kevin Bacon, De'Angelo Wilson, David Ramsey, Lil' JJ, Joyful Drake, Queen Latifah, Reagan Gomez-Preston, Monica Calhoun, Alfre Woodard, Paige Hurd, Keshia Knight Pulliam, Djimon Hounsou, Golden Brooks, Sherri Shepherd, Della Reese, Octavia Spencer, Mena Suvari, Andie MacDowell, Alicia Silverstone
Max McGillivray, Elijah Guo, Token, Cliff Moylan, Christopher O'Shea, Jake Picking, Themo Melikidze, Lana Condor, James Colby, Rachel Brosnahan, Jimmy O. Yang, Erica McDermott, Kevin Bacon, Ken Casey, Vincent Curatola, Michael Beach, Alex Wolff, Sean Avery, David Ortiz, Khandi Alexander, Michelle Monaghan, John Goodman, Nina Dobrev, Peter Berg, Mark Wahlberg, J. K. Simmons, Melissa Benoist, Barack Obama